,Text,retweets,polarity,subjectivity
0,"it would be interesting to see if the wuhan coronavirus binds to the angiotensin-converting enzyme 2 (ace2) receptor just like sars to invade our cells. if so, we can potentially use ace2 as a competitive inhibitor to treat these coronavirus infections in hypertensive patients.",87,0.25,0.75
1,cbp enacts ‘enhanced health screening’ as chinese coronavirus comes to u.s. http://bit.ly/2tocj7j via @breitbarttexas,57,0.0,0.0
2,chinese coronavirus may have been lurking in animals for decades,23,0.0,0.0
3,"cdc and who are learning more about this new coronavirus every day. at this time, the actual risk to new yorkers is low, but our level of preparedness is high. we are monitoring the situation daily.",25,0.13324675324675325,0.3355844155844156
4,"my take: china is doing a massive cover up & practicing criminal negligence. lots of people are going to the hospitals with symptoms, but they are not tested for #coronavirus, they get diagnosed with ""viral pneumonia"", get left to die, quickly cremated &amp; are not counted in stats",23,-0.016666666666666677,0.5125
5,"#hkpoliceterrorists are out of control. they don’t really listen to commanders, just vent their sadistic angers to #hkers. #hkpolicebrutality ? #bloodycarrie how long you can keep covering up this? like #ccp conceals #coronavirus for 2-3months?",39,0.07500000000000001,0.30000000000000004
6,"can't wait until the ""why are you focusing on the bernie/warren feud when there's impeachment?!"" tweets are devoured by the ""why are you focusing on the impeachment when there's coronavirus?!"" tweets and we get to see the final evolution of distraction pearl-clutching.",9,0.0,1.0
7,first month of the year vs second month of the year #coronavirus,388,0.125,0.16666666666666666
8,#coronavirus les hice un meme,10,0.0,0.0
9,"#update: with #lunarnewyear celebrations about to begin, it's feared more #virus infections will happen as millions of people travel across #china and the world. but what exactly is a #coronavirus? @who @smartraveller",23,0.375,0.375
10,a suspected coronavirus patient is being transported to a hospital in china's huizhou #ncov2019 (via @jia_hker),411,0.0,0.0
11,".@cdcgov has confirmed the first u.s. case of the new and deadly coronavirus, which is spreading rapidly and sickening hundreds in china. health officials in six u.s. airports are now screening for the virus. mark strassmann reports https://cbsn.ws/3ar3ftt",259,-0.06272727272727271,0.6375757575757576
12,federal health officials have confirmed that a case of coronavirus has been diagnosed in seattle: https://nbcnews.to/2o2khaj @miguelnbc has the latest now.,26,0.45,0.95
13,so if you’re thinking about pandemics in light of the coronavirus today 1) stay calm 2) we are blessed to have a level of medical care that was not available during most pandemics and 3) here is a book i wrote: https://www.amazon.com/get-well-soon-historys-plagues/dp/1627797467/ref=nodl_,7,0.2,0.47000000000000003
14,"the wuhan coronavirus outbreak #ncov2019 raises an imperative for #publichealthlaw to address #globalhealth threats. to meet this imperative, @lawrencegostin and i have launched a quarterly #jlme column on #globalhealthlaw. read our opening column at: https://journals.sagepub.com/doi/abs/10.1177/1073110519897794?journalcode=lmec",25,0.0,0.0
15,#cyberpunkisnow coronavirus makes me even more concerned about the possible consequences of pig + human chimera &amp; monkey + human chimera experimentation in china &amp; other nations. https://www.livescience.com/first-monkey-pig-chimeras-born-in-china.html https://www.theguardian.com/technology/2019/aug/11/the-five-chimeras-human-monkey-hybrid-genetic image: 4-week-old pig embryo with human stem cells,12,0.04642857142857143,0.3107142857142858
16,"a traveller from china has been diagnosed in seattle with the wuhan #coronavirus, according to us health officials",58,0.0,0.0
17,coronavirus has spread from china to at least five other countries https://www.bloomberg.com/news/articles/2020-01-21/china-virus-s-spread-puts-global-health-officials-on-high-alert?srnd=premium-asia,1018,-0.2125,0.3875
18,the 'novel coronavirus' outbreak has officially reached the united states,15,0.0,0.0
19,scientists want to cut wuhan off from the world to fight the deadly coronavirus,17,-0.2,0.4
20,we're working with local and federal partners to respond to a novel coronavirus (2019-ncov) that was first identified in early january in china: https://on.nyc.gov/37e8ybi,6,0.11666666666666665,0.2111111111111111
21,"there are currently no confirmed cases of 2019 novel coronavirus in seattle and king county, but the @cityofseattle is closely monitoring this developing situation in coordination with partners at @kcpubhealth, @wadepthealth and the @cdcgov.",2,-0.2,1.0
22,travel ban on china due to corona virus maybe mexico as well those,3,-0.125,0.375
23,several passengers coming off the united flight from shanghai say 2 people were removed from their flight in chicago because they were sick. reaching out to chicago health officials to see if this is connected to #coronavirus passengers say they were screened in china. @tmj4,14,-0.35714285714285715,0.42857142857142855
24,anxiety grew both at home and abroad after chinese government expert zhong nanshan confirmed fears that the new type of coronavirus can spread from human to human.,8,0.10727272727272727,0.33090909090909093
25,coronavirus: first u.s. case confirmed in washington state - the washington post @who @cdc,5,0.325,0.6666666666666666
26,i see the gop is not freaking out at all or possibly hoping a coronavirus outbreak upends the news cycle about impeachment. totes normal stuff yo. @minggao26 @ericgarland @gametheorytoday @thespybrief @soychicka @xeni @hateshorseshoes,2,0.075,0.825
27,"thread of articles about coronavirus, starting with an article from yesterday new china virus: cases triple as infection spreads to beijing and shanghai",60,0.06818181818181818,0.2772727272727273
28,my discord has apparently turned into a prepare yourself for the apocalypse and up to date news on the #coronavirus discord,2,0.05,0.35
29,drank a beer and caught a corona virus.,4,0.0,0.0
30,"dear @ygent_official please reconsider to reschedule sechskies fansign in china . because of the coronavirus , everyone’s health comes first !",20,0.3125,0.3333333333333333
31,"where is the health minister & what’s being done to protect wa? we have we only heard from the junior tourism minister who said that a decline in visitor numbers was the only worry coronavirus is shaping up to be a significant issue, we have direct flights, where is the wa govt",7,0.11875,0.81875
32,soo since i’ve been seeing a lot of misinformation about infectious disease/epidemiology revolving around the wuhan coronavirus i thought i would start a little #scicomm thread /1,15,-0.1875,0.5
33,but not china where right now is the incubator of the coronavirus,5,0.2857142857142857,0.5357142857142857
34,but all i can think of is the #coronavirus though...,1,0.0,0.0
35,who to hold emergency session on new coronavirus https://www3.nhk.or.jp/nhkworld/en/news/20200122_11/,14,0.13636363636363635,0.45454545454545453
36,"during the sars outbreak in the early 2000s, china initially withheld information about it from the public and vastly underreported cases of infection. the virus, which was also caused by a coronavirus, killed 774 people.",12,-0.02,0.2733333333333333
37,"a wuhan resident posted images of her mother’s diagnosis of viral pneumonia & described long queues of patients with similar symptoms late on monday night, none of whom appeared to have been tested for coronavirus. “could all these people suddenly have viral pneumonia?” she said.",11,-0.0875,0.475
38,breaking news: the first u.s. case of the wuhan #coronavirus has been confirmed in washington state. the virus has spread from china to at least 4 other countries.,10,0.05625000000000001,0.5270833333333333
39,"whoever didn't vote for jeter -- i hope your kids don't get christmas gifts, i hope you get coronavirus, i hope you get sudden onset diarrhea on a cross atlantic flight, i hope you drop $20 and don't realize it, i hope your spouse breaks up with you on valentine's day ...",1,0.0,0.25
40,#coronavirus in usa.... coincidence there was a recent drill in the state of our first usa victim? i think not folks. rev scott has some good info on what is happening. be aware and be prepared.,13,0.225,0.2966666666666667
41,"how nice for the democrats! the news will now go away from their sham articles of impeachment, over to the news that the coronavirus which turns into sars has arrived in the united states courtesy of china, who didn't think reporting it after the 1st few deaths was that important",53,0.1875,0.6000000000000001
42,"cdc travel health notice: novel coronavirus in #china: there is an outbreak of pneumonia in #wuhan, china, caused by a novel (new) coronavirus. older adults and people with underlying health conditions may be more likely to get severe disease. https://bit.ly/37be2s5",97,0.20075757575757575,0.571969696969697
43,"the wuhan coronavirus #ncov2019 is now spreading between humans. here's why it started in a wildlife market. my debut for @natgeo feat. cdc's @drnancym_cdc, ian lipkin of @columbia_cii/@columbiamsph and @nycbat of @ecohealthnyc",44,0.0,0.0
44,"in contagion, gwyneth paltrow was the first to die. #coronavirus",3,0.25,0.3333333333333333
45,me: *cough* scientists: the #coronavirus replicates cold like symptoms. me:,63,-0.6,1.0
46,health officials urge calm as the fast-spreading #coronavirus reaches the united states. here's what you need to know. (via @elemental),21,0.30000000000000004,0.75
47,the @wadepthealth confirmed the first case of a novel coronavirus in the u.s. in a resident of snohomish county. our health officer @docjeffd answers questions about what we know so far about this new virus. http://ow.ly/ay9y50y1sir #2019ncov #coronavirus,43,0.2215909090909091,0.6969696969696969
48,"here is a canadian and global perspective of the current coronavirus outbreak in china. this was a conversation with @mattgallowaycbc, dr. allison mcgeer and i, weighing in this morning on @cbcthecurrent https://tinyurl.com/sexukzw #coronavirus #publichealth",10,0.0,0.2
49,there is a confirmed case of coronavirus in washington state. it's here. i suspect there are many more unknowns here is as well.,15,0.4666666666666666,0.6666666666666666
50,what's this corona virus? i had a few over the weekend! should i go to the dr's? am i going to die?,11,-0.25,0.1
51,wuhan coronavirus may have been transmitted to people from snakes http://bit.ly/2rgp6f9,132,0.0,0.0
52,coronavirus; all you need to know ctto,54,0.0,0.0
53,"this coronavirus has its origins in china, just like sars, swine &amp; bird flu and the original black death plague. also, despite the name, the most prolific killer in modern times - the spanish flu also started in china.",232,0.1816666666666667,0.39666666666666667
54,"coronavirus: 1/2 we have put in place proportionate, precautionary measures building on those already in place in wuhan and are closely monitoring the situation. a port health team is meeting each direct flight from wuhan to provide advice and support to those that feel unwell...",283,0.1,0.4
55,will coronavirus be the sixth international emergency to be declared in the last decade? the world health organization will decide tomorrow.,26,0.0,0.03333333333333333
56,"as the 2019-ncov infection just started spreading, these researchers confirmed that the coronavirus uses the human ace2 receptor for cell penetration. the best part? we don't have to wait 6 months to read about this. preprints matter.",10,0.4666666666666666,0.46666666666666673
57,"extraordinary measures being taken to try to contain the coronavirus in china: all travel will be suspended out of wuhan, a city of 11 million people, two hours from now. as many as a million train passengers and 800 flights go through wuhan a day",321,0.41666666666666663,0.75
58,"if more zoonotic virus are to be stoped from spillover from wildlife to humans, wildlife trade & consumption in china has to stop & be further controlled. #wuhan #coronavirus",4144,0.25,0.5
59,this is unprecedented war time level mobilizations to fight spread of #coronavirus. now think about why western media is rampant with stories that china is trying to cover up the outbreak and how msm china reporting is always done to paint big bad china...,30,-0.024999999999999967,0.41666666666666663
60,"latest on #coronavirus in china: - 553 confirmed - 17 deaths all public transportation, outward flights and trains to be suspended starting from 10 a.m. thursday until further notice in #wuhan, the central china's city battling the virus outbreak",415,0.15,0.4694444444444444
61,walk with @cbsnews into wuhan airport screening. body temperature checks now in force on top of regular “terror” screening. our asia crew got swabbed and thermally imaged for fever - a #coronavirus symptom. we got through ok. details on the @cbseveningnews tonight. stay safe! – at wuhan tianhe international airport (wuh) 武汉天河国际机场,52,0.325,0.3153846153846154
62,"the simpsons predicted the future again, this time the coronavirus. #coronavirus",249,0.0,0.125
63,"here are the symptoms of the wuhan coronavirus, according to a new cdc warning",27,0.13636363636363635,0.45454545454545453
64,"therapist: sooooo, how's 2020 going? me: #coronavirus #australiafires #wwill",1076,0.0,0.0
65,chicago’s o’hare airport begins testing travelers from china for coronavirus https://www.oann.com/chicagos-ohare-airport-begins-testing-travelers-from-china-for-coronavirus/ #oann,119,0.0,0.0
66,"chinese officials have put wuhan, the epicenter of the coronavirus outbreak with a population of 11 million, under an unprecedented quarantine ahead of lunar new year, as health officials globally scramble to contain the illness. @ramyinocencio reports https://cbsn.ws/2twgfsr",32,0.18409090909090908,0.3386363636363636
67,there’s so much good analysis and insight in this column by ⁦@liyuan6⁩ on how party officials have handled the wuhan coronavirus so far,80,0.39999999999999997,0.8
68,"the coronavirus has landed in the u.s., @ronaldklain and nicole lurie write. here’s how we can reduce the risk:",21,0.0,0.0
69,quarantine tents have been set-up in their neighbourhood in wuhan #coronavirus,41,0.0,0.0
70,see why the @who delayed their decision on whether novel #coronavirus is global health emergency. #pheic,15,0.0,0.0
71,us coronavirus: here's how to protect yourself from the new illness - cnn,4,0.13636363636363635,0.45454545454545453
72,"the chinese government will quarantine the city of #wuhan, the epicenter of a breakout of #ncov #coronavirus. the city will cancel planes &amp; trains leaving the city &amp; suspend buses, subways &amp; ferries, to reduce risk of spread of the new virus. https://thehill.com/policy/healthcare/479418-chinese-government-quarantines-the-city-of-wuhan",17,0.06818181818181818,0.22727272727272727
73,#abc_challenge here is a double whammy if you buy stuff made in #china mask made in china can cause cancer! just when you need them with their other export #coronavirus or #wuhanvirus,7,-0.0625,0.1875
74,coronavirus. find your beach (away from the us).,1,0.0,0.0
75,anon from one of the chans outlining one theory of the corona virus... i don't believe anything the chinese are saying. @honeedesigner @rolandiakarnak @tyedyetweety @redpill_beena @inthenameoflo19 @disprop45895392 @inevitable_et @catnamus @eyesonq @catvllvsverona,18,0.0,0.0
76,17 confirmed deaths by coronavirus cover your mouths when you cough and sneeze and wash those damn hands!! i will fucking call you out if i see you do otherwise.,13,0.012500000000000011,0.9
77,the mighty @lealokkk is inside #wuhan airport filing video for @scmpnews as people make their escape from the #coronavirus quarantine lockdown,3,0.4,0.9
78,the coronavirus is what you tell your parents your family desktop computer has when they catch you looking at vin diesel deepfakes,1,0.0,0.0
79,wondering if #nancypelosi actually has #coronavirus?,2,0.0,0.1
80,"unfortunately nothing has improved compared with 2003, except the mobility of people (now you may call the secondary source of coronavirus). i am sure there is a significantly time lag in the available data for the infected.",8,0.095,0.6927777777777778
81,be prepared! stock up on limes in case you catch the coronavirus. #coronavirus,14,0.0,0.0
82,traffic has also been blocked on the highways in wuhan #coronavirus,21,0.0,0.0
83,"hong kong says a 2nd patient has ""preliminarily"" tested positive for the new coronavirus. everyone who traveled with him on air china flight 8279 on jan. 19 is asked to call a hotline.",15,0.12121212121212122,0.3333333333333333
84,maps: where the wuhan coronavirus has spread,16,0.0,0.0
85,"set up for panic attack : 1. in bed recovering from influenza that made you sicker than you have ever been as an adult (thank goodness for vaccine) 2. while sick, binge watch pandemic on netflix 3. on twitter, read about new coronavirus outbreak",1,-0.15930735930735931,0.5372294372294372
86,all 11 million wuhan residents have been ordered to wear masks in public or face criminal charges as the city is quarantined. #coronavirus,12,-0.2,0.30833333333333335
87,"now that wuhan is shutting down, my colleagues who are on the ground are prepared to stay in the city for at least two more weeks, which could also be 4-8 weeks #coronavirus",4,0.0148148148148148,0.3962962962962963
88,"the world is better prepared than ever to stop the wuhan #coronavirus, but its true dangers will not be known for some time https://www.economist.com/leaders/2020/01/22/the-world-is-better-prepared-than-ever-to-stop-the-wuhan-coronavirus?fsrc=scn/tw/te/bl/ed/outofchinatheworldisbetterpreparedthanevertostopthewuhancoronavirusleaders via @theeconomist",10,0.425,0.575
89,"""basically, do not go to #wuhan. and those in wuhan please do not leave the city,"" said #china national health commission vice-minister. 9 million people in quarantine due to #coronavirus.",7,-0.125,0.375
90,"hubei province announces 17 deaths and 444 cases of coronavirus. top comment: ""hurry up and tell your family members. stop treating this as if it isn't something serious."" [+73651] read more: http://centkent.blogspot.com/2020/01/hubei-province-announces-17-deaths-and.html",15,0.22222222222222224,0.5555555555555555
91,"headline: ""wuhan coronavirus may have been transmitted to people from snakes"" public: scientists: wow that is so freakin' cool! (actual quote from article: “we are excited about this new speculation”).",19,0.17481060606060606,0.5035353535353536
92,"yes, china is never a trusted partner. for this critical matter of global health, china still put political concerns before safety of people. it's under fierce criticism china deliberately withheld info concerning the spread of the novel coronavirus.",10,0.0,0.3
93,my friends’ apartment complex getting disinfected in wuhan yesterday #coronavirus,237,-0.3,0.4
94,coronavirus arriving in the uk whilst the nhs is on its knees,38,0.0,0.0
95,asia stocks set to dip as coronavirus death toll rises in china,12,0.0,0.0
96,leading the network evening newscasts tonight: cbs/nbc leading with the impeachment trial; abc leads with the coronavirus situation.,13,0.0,0.0
97,here are 5 things we learned wednesday about the chinese coronavirus outbreak,169,0.0,0.0
98,"a tourist from mainland china, who had recently visited wuhan, was the first case of the new coronavirus confirmed in hong kong http://sc.mp/clig3",31,0.1965909090909091,0.509469696969697
99,"evening news updates: 1. china quarantines #wuhan amid coronavirus 2. relative: #chinahospital refuses patients 3. leaving davos, trump talks #trade, #wto live now: https://theepochtimes.com/live",24,0.06818181818181818,0.25
100,"the coronavirus outbreak must serve as a wake-up call to governments around the world, but especially to the one in washington, d.c.",15,0.0,1.0
101,"and what do you know! yesterday novavax announced a human version of a coronavirus vaccine based on nanoparticles, just in the nick of time to save the world from sure death! their stock is already up 60%.",265,0.3125,0.4944444444444444
102,be safe. please get some smart scientists to work on a cure for #coronavirus soon!,45,0.3839285714285714,0.5714285714285714
103,sharing this info about #coronavirus for public awareness. stay safe everyone.,563,0.25,0.2833333333333333
104,bill and melinda gates foundation & others predicted up to 65 million deaths via coronavirus – in simulation ran 3 months ago!,165,0.0,0.0
105,"kindly help to trend the hashtag we, elf, would also like to cancel or postpone thos concert due to the corona virus. please use hashtag below : #슈주레이블_홍콩콘_취소부탁드립니다 thank youuu :)",88,0.325,0.7583333333333333
106,#coronavirus starter pack:,175,0.0,0.0
107,"ooof, just a couple of days ago we have vaccine shill ""dr."" peter hotez talking to cnn saying that vaccines for coronavirus are already a comin'! did you see him on rogan? gross.",137,0.0,0.0
108,caught on camera: eating a bat amid coronavirus epidemic,44,0.0,0.0
109,"first, texas a&m grads destroy billions in shareholder capital running shale companies into the ground. then they threaten to take down the entire united states with the coronavirus. we must shut down @tamu and quarantine college station immediately. enough is enough.",11,-0.037301587301587315,0.36230158730158735
110,so i've been reading about this corona virus and then i go on netflix and there's a fucking show about pandemics out right now hmm what a coincidence,7,-0.15714285714285714,0.6678571428571429
111,are you catching the coronavirus from other bitches yes or no,40,0.2375,0.6375
112,"video: chinese doctor cries, begs for help treating corona virus as hospital runs out of beds",25,0.0,0.0
113,"terrifying videos of contagion-like scenes appear to show people infected with coronavirus being taken in boxes and tubes, while doctors collapse in the middle of a hospital.",30,-0.5,0.5
114,"on jan. 2, china central tv(cctv) announcing that 8 people were arrested in #wuhan for spreading rumors about the #wuhanpneumonia #wuhansars #coronavirus . and now they have locked down 8 cities and let over 11 millions people help themselves. isn't this anti-humanity crime?",45,-0.07777777777777779,0.2694444444444445
115,i had an important call today with @who director general @drtedros about working together on a global response to the 2019 novel #coronavirus. @hhsgov strongly supports preparedness and response work here in the u.s. and abroad.,41,0.22083333333333333,0.5583333333333333
116,"scmp: ‘fifteen cases of the coronavirus have been officially reported among medical staff in the city, but doctors say the true number is far higher’",61,0.175,0.5375
117,scmp: #wuhan medical staff being infected by the #coronavirus at a faster pace than is being reported.,78,0.0,0.0
118,well - i have learned that #coronavirus is mutating and learning pretty fast - but reaching twitter so fast is impressing me,6,0.21666666666666667,0.7333333333333334
119,all four suspected #coronavirus cases tested negative - #moh @dghisham #negative #2019ncov @who http://bernama.com/en/general/news.php?id=1808944#.xioyghwhp1k.twitter,11,-0.3,0.4
120,"student in #wuhan has allegedly posted on a forum using a vpn, and has described the scenes of the #coronavirusoutbreak. “here it is not allowed to talk-criticise about the virus, jail sentence is sure if one does”. #coronavirus #2019ncov #2019_ncov",26,0.09999999999999999,0.3296296296296296
121,hint at what trump might do if wuhan coronavirus crisis worsens #ncov2019,5,0.0,0.0
122,the videos coming out of #coronavirus hit areas have got me thinking that it's a lot worse than china is making out. to quarantine cities with 10s of millions of people is extreme for a strain of pneumonia! hopefully this will teach people to stop eating bats ect,1,-0.278125,0.8
123,imagine having sex with a hot chinito boy only to get contracted by the coronavirus in the end,3,0.125,0.925
124,"that corona virus ain’t gonna get me, this aggie is prepared. #tamu",2,0.0,0.0
125,ya might as well slide into my dms so we can coronavirus and chill. you don't have enough time to be picky darlin' we're all going to die soon.,1,0.0,0.5
126,#coronavirus #masa #makeamericasafeagain @1munder @imperatortruth @nulookrefinish @wearechangenyc their hard facts!!!!!!!!! civica rx https://www.performrx.com/sites/default/files/downloads/drug%20information%20update%20september%202019.pdf,13,-1.0,0.5416666666666666
127,the american airlines flight attendant union is calling on us airlines to step up precautions for the deadly wuhan coronavirus,11,0.0,0.26666666666666666
128,i usually don’t contract the coronavirus until may 6th,3,-0.25,0.25
129,there could be a second chinese coronavirus case in the us,9,0.0,0.0
130,some work chatter... on the chinese novel corona virus.,3,0.0,0.0
131,are we going to give them coronavirus now?,0,0.0,0.0
132,4 more cases of coronavirus confirmed in beijing; several in canada under watch for infection,6,0.3,0.5
133,got an sms message from the hubei new corona virus pneumonia prevention hq yesterday evening. paraphrasing. stay healthy: - wash hands - wear a mask - ventilate your room - cook your food well - listen to your doctor - don't panic keep yourself safe and uphold societal order.,3,0.37878787878787873,0.48484848484848486
134,this woman's escape from #wuhan to #france has put many people in danger. #wuhanvirus has more chance now to spread to those who weren't exposed. coming closer to a #pheic. #publichealth #coronavirus #china,9,0.5,0.5
