,Text,retweets,polarity,subjectivity
2275,"what exactly is ""a dry cough?"" #covidー19 #coronavirususa #coronavirus",6,-0.06666666666666665,0.6
2276,long list of events cancelling due to fear of coronavirus spreading. never seen anything like this. what’s everyone’s thoughts?,6,-0.0875,0.3875
2277,please read our statement on the coronavirus for breakoutcon 2020: https://breakoutcon.com/breakout_coronavirus_update,9,0.0,0.0
2278,septa ramps up cleaning efforts on buses and trains amid coronavirus outbreak http://dlvr.it/rrprzx,3,0.0,0.0
2279,more graves being dug in the middle of the night for #coronavirus victims. why does the regime insist on burrying them at nighttime? #iran,13,0.25,0.25
2280,"my conclusion after spending the last week in washington dc talking about the coronavirus with colleagues, friends and strangers of all ages: the degree of concern or lack thereof is directly aligned with partisan affiliation. so, now you can predict results.",6,0.05,0.23333333333333334
2281,"florida is guaranteeing widespread illness & death because it won't test for community transmission. “we’re wanting to ensure that doctors don’t willy-nilly just kind of say ‘you have the sniffles? go,’” ~ lt. gov. jeanette nuñez http://hrld.us/2v5ncbw #covid19 #coronavirus",31,0.6,0.9
2282,"in the last couple of weeks the #coronavirus cost me thousands of dollars via the market, cancelled my #sxsw hopes, caused me to be in a crummy mood, and ended in me starting to drink a lot. the corona virus is my ex girlfriend.",3,0.0,0.08333333333333334
2283,i have a cold so i am drinking nyquil and writing out my will since i assume it’s the corona virus,4,-0.6,1.0
2284,"the best thing about the coronavirus is that ""self-isolating"" is a valid excuse now for bailing",3,0.475,0.175
2285,absolutely essential reading for every gp in the land right now. one to bookmark and rt: coronavirus disease 2019 (covid-19): a guide for uk gps | the bmj,9,0.14285714285714285,0.4178571428571428
2286,you can get coronavirus just by being a guest on someone’s podcast,4,0.0,0.0
2287,not scared of coronavirus when you sell soaps,0,0.0,0.0
2288,i'm now getting into the habit of regularly disinfecting my cell phone due to the coronavirus. you filthy fuckers.,39,-0.30833333333333335,0.483974358974359
2289,"unpopular opinion: at this point, i think most of the us population would test positive for the #coronavirus. so many dont even know they have it. i will continue to live my life as i always have....clean. #washyourhands",8,0.34090909090909094,0.5113636363636364
2290,if you ever drank a four loko you are immune from the coronavirus,27,0.0,0.0
2291,i will not be canceling amity’s annual st patrick’s day parade and pub crawl. alcohol kills germs so there’s absolutely no reason to panic over this #coronavirus!,43,-0.1875,0.5666666666666667
2292,i keep wondering about the domestic and global economic impact of the coronavirus. i feel like it’s going to jumpstart this recession everyone has been talking about in the past year.,3,-0.012499999999999997,0.1375
2293,#breaking please share this info about possible public exposure to the #coronavirus in montgomery county @nbcwashington nbcwashington,28,0.0,0.5333333333333333
2294,no offense but if i was at coronavirus outbreak i wouldv stopped it,43,0.0,0.0
2295,"if you’ve breathed the air in clinton, iowa you’re immune to the coronavirus",204,0.0,0.0
2296,half of the roster can have the coronavirus and vince won't cancel wrestlemania. spare me.,8,-0.16666666666666666,0.16666666666666666
2297,"as a coronavirus pandemic approaches, tennessee's hospital landscape dries up due to lack of medicaid expansion. meanwhile the @tngop has awarded rush limbaugh a nice plaque and freed gun owners from responsibility for competent ownership. we're so screwed.",13,0.325,0.6805555555555555
2298,"trudeau has created the conditions of, 'the perfect storm'. massive deficit spending, railway blockades and supply chain disruptions coupled with massive inflation now add #coronavirus while he pays the media to lul canadians into a sense of false security.",36,0.14999999999999997,0.9
2299,"""the president went off on inslee for saying that he wanted trump to stick to the science when discussing the coronavirus outbreak.""",48,0.0,0.0
2300,i need be quarantined. not because of coronavirus or any infectious conditions. im just super annoying,53,-0.23333333333333336,0.7833333333333333
2301,"seems from this the decree will be out some time tonight or tomorrow, barring outward travel etc. how many came into dublin from there in the last three days? ‘coronavirus: milan set for lockdown with italy poised to shut worst-hit region’",24,0.25,0.2833333333333333
2302,if a lot of people die due to coronavirus then housing supply will increase as rates decrease. probably a good time to get a real estate agent license just in case.,15,0.2583333333333333,0.42500000000000004
2303,"trump, pence attended cpac — where an attendee tested positive for coronavirus",18,0.22727272727272727,0.5454545454545454
2304,a resident of rep. matt gaetz’s district died of coronavirus shortly after gaetz mocked the virus response on the house floor. https://www.politicususa.com/2020/03/07/matt-gaetz-coronavirus-death.html via @politicususa,111,0.0,0.3
2305,"he had a runny nose after travelling to ""a low risk country"". it's a 'novel' virus - meaning 'new' ... he tested himself and diagnosed coronavirus. how is he a poor diagnostician?",5,-0.08787878787878789,0.4515151515151515
2306,"a cpac attendee has tested positive for the coronavirus. this was an event attended by trump &amp; pence, along with fl’s freakish matt gaetz— &amp; by tons of anti-vaxxers. trump promised that test kits are available for anyone who needs them. let’s just see.",224,0.31363636363636366,0.4727272727272727
2307,"since the coronavirus bouta kill us all, who’s tryna fuck???",14,-0.4,0.6
2308,"if we have to ban large gatherings due to the coronavirus, at least the biden campaign will be able to hold its “rallies” as normal!",7,0.09535714285714285,0.4957142857142857
2309,did you know... the united nations world economic forum world health org bill & melinda gates foundation cdc from us & china vaccine manufacturers central banks & the media held a #coronavirus simulation right before the actual coronavirus outbreak?,285,0.12142857142857143,0.27142857142857146
2310,"how did you stop biting your nails, asking because coronavirus",33,0.0,0.0
2311,". maga health - infectious disease doctor / trump acting 'diligently' dr. dan o'brien, public heath and infectious disease specialist, on trump's handling of coronavirus - trump has acted 'very diligently' . oan report &gt;",182,0.06666666666666667,0.12222222222222222
2312,"priests performed a ritual yesterday at kinpusen-ji in nara, to pray for an early end to the coronavirus epidemic. https://mainichi.jp/english/articles/20200307/p2a/00m/0na/006000c",99,0.1,0.3
2313,"the first case of coronavirus has been confirmed in washington, d.c., according to mayor muriel bowser. how long will it be before trump flees to mar a lago?",104,0.19999999999999998,0.5777777777777778
2314,"i pulled the single most masterful parallel parking job this evening just a block from the wilson building, where @mayorbowser is going to give us details on the first positive coronavirus case in the city. a couple stopped just to congratulate me for the parking job.",4,0.31764069264069267,0.4321789321789322
2315,"many experts, including me, have rightfully criticized trump for his inaction in response to the #coronavirusoutbreak. trump has called such criticisms a “hoax,” and has repeatedly downplayed the seriousness of the #coronavirus.",156,0.25,0.5
2316,fact check: pres. trump is falsely blaming the obama administration for the slow rollout of u.s. tests for the new coronavirus—ignoring his administration’s own fumbles in responding to the health crisis and mischaracterizing obama-era policies.,447,0.009090909090909038,0.6136363636363636
2317,top federal health officials on saturday said they don't know how many people in the u.s. have been tested for coronavirus — or how many will need to be in the coming weeks. https://politi.co/39xq6hv via @politico,41,0.5,0.5
2318,"since it’s sounding more and more like all of us are going to be exposed to the #coronavirus, do you know anyone who has tested positive and been through it? just wondering what it feels like for the otherwise healthy adult...",17,0.3654545454545455,0.46909090909090906
2319,the coronavirus got me singing happy birthday while washing my hands,21,0.8,1.0
2320,russia has mobilized “an entire ecosystem” of disinformation to prey on global fears that have accompanied the outbreak of the coronavirus.,8,0.0,0.3125
2321,i heard melania is building the tennis pavilion out of coronavirus test kits.,1,0.0,0.0
2322,the extraordinary chain of events that led to a covid-19 global health crisis. watch the replay of our special 2-hour live special 20/20 about the coronavirus “outbreak: what you need to know” online now.,14,0.23679653679653678,0.5285714285714285
2323,#resistanceunited open &amp; watch a maga who believes trumps #propaganda #trumpisanidiot &amp; his supporter says #coronavirus doesn't exist?! #trumpliesaboutcoronavirus &amp; ⁦@whitehouse⁩ is lying to the people &amp; the press! hear her reasoning,7,-0.078125,0.3
2324,cuomo declares state of emergency in new york as state coronavirus cases soar to 89,7,0.13636363636363635,0.45454545454545453
2325,first coronavirus case confirmed in d.c. https://politi.co/32xrmik via @politico,2,0.325,0.6666666666666666
2326,coronavirus: new york declares state of emergency,6,0.13636363636363635,0.45454545454545453
2327,latest numbers from italy show 99% of coronavirus deaths are people 60 and older!,14,0.35416666666666663,0.6166666666666667
2328,"government, unions and employers to come together for #coronavirus talks #auspol",5,0.0,0.0
2329,honestly his music is so bad that not even the corona virus would show to his concerts.,5,-0.04999999999999993,0.7833333333333333
2330,a resident of rep. matt gaetz’s district died of coronavirus shortly after gaetz mocked the virus response on the house floor. https://www.politicususa.com/2020/03/07/matt-gaetz-coronavirus-death.html via @politicususa,129,0.0,0.3
2331,coronavirus (#caronavirus) passing around conference,5,0.0,0.0
2332,"update from our latest newsletter: iran says it's authorized release for 54,000 prisoners. there is no way to verify how many have actually been released &amp; these numbers don't include those held on political and national security charges. #coronavirus",7,0.25,0.4
2333,barron's on marketwatch: san francisco's aggressive coronavirus approach,10,0.0,0.0
2334,"coronavirus just took the first victim in my country, we had 1 case and now 8 cases. this is scary and sad",0,-0.20625,0.5958333333333333
2335,"flight are cheap asl rn bc of the coronavirus, but im a real nigga so ion got nothing to worry about",10,0.30000000000000004,0.5
2336,right-wing pastor: god sent us coronavirus because of homosexuality via /r/atheism https://ift.tt/2txkz5h #atheist #humanist,15,0.0,0.0
2337,coronavirus-infected doctor hits back after criticism from victorian health minister,3,0.0,0.0
2338,can you catch coronavirus via saliva? because i think my dick just sneezed.,13,0.0,0.0
2339,is the corona virus in ur city?,0,0.0,0.0
2340,donald trump attended the cpac conference where at least one person has tested positive for coronavirus. i wonder if that person touched this flag.,25,-0.03636363636363636,0.4727272727272727
2341,"due to the coronavirus, this is how i’ll be taking the stairs from now on... https://twitter.com/holdmyale/status/1236002154256703498/video/1",25,-0.125,0.375
2342,"given coronavirus fears, more people should know about the corrupted blood bug in world of warcraft that caused player chars to be infected with a killing debuff that soon spread to other players epidemiologists actually studied this to see how ppl would react to an epidemic irl",8773,0.125,0.325
2343,"""governments can either minimize #coronavirus deaths or the economic impact but not both."" in us economic impacts significant if overwhelmed hospital systems. early npi's needed.",66,0.21875,0.39375
2344,here is an excellent article on how coronavirus can infect lungs and cause much damage. i found the diagrams helpful! facts about novel coronavirus and how to prevent covid-19,22,0.625,0.6
2345,my mom is giving me great tips to avoid the coronavirus and very frequently which is helpful.,5,0.465,0.5700000000000001
2346,planning on using coronavirus to cancel all plans well into 2021.,198,0.0,0.0
2347,"“coronavirus mostly affects older people, i don’t know why you’re panicking” me:",55,0.3333333333333333,0.41666666666666663
2348,having both depression and anxiety can be kind of wild because one day you have literally no will to live and the next you’re so afraid of having to be quarantined by coronavirus you buy 20 cans of peaches to have something to survive on,5,0.047272727272727265,0.54
2349,"oh, really @who, you’re still spouting nonsense without any proof &amp; expecting us to believe that #wuhan, city of 11mm people, in china run by a vicious chinese dictator, xi, has #coronavirus contained &amp; that they’ve done a great job. china only has govt controlled media. hello???",60,0.0,0.5900000000000001
2350,if your grandma ever took you to eat at hometown buffet as a kid you’re immune to the corona virus,22,0.0,0.0
2351,"i’ve heard people say that coronavirus “only takes the old, sick and unhealthy” and “no need to worry if you’re young and healthy”. what is unhealthy is this type of statement. coronavirus is causing an “i'm alright, jack"" pandemic. #coronavirus #covidー19",151,-0.11632653061224489,0.6224489795918366
2352,if you’ve had water from the moses lake in your mouth you’re immune to the coronavirus,33,0.0,0.0
2353,"#trump is trying to hold the number of #coronavirus cases down by not providing adequate number of #testkits so that people can be tested. if people can’t be tested, they also can’t be added to the number of confirmed cases in the us. #covid19",20,0.19259259259259257,0.5407407407407407
2354,white house officials believe u.s coronavirus cases to double in the next 48 hours -- wp,89,0.0,0.0
2355,humbling experience for sure from flexing her onlyfans earnings to being in jail yikes and faking corona virus to have somewhere to stay,4,0.2,0.4444444444444444
2356,president trump has a personal responsibility to visit & embrace all people in the us who contract coronavirus.,27,0.0,0.3
2357,washington (ap) -- gop sen. ted cruz staying at home for 2 weeks after shaking hands with man who tested positive for coronavirus.,38,0.22727272727272727,0.5454545454545454
2358,bill gates donating $5 million for coronavirus testing,14,0.0,0.0
2359,#breaking senator ted cruz isolates after interaction with coronavirus patient,31,0.0,0.0
2360,"when i asked why @joebiden has not been sticking around after his last few events to meet with attendees—something that he clearly enjoys while on the trail—his campaign seemed to indicate that it was due to concerns about coronavirus, issuing this statement to @abc",134,-0.056249999999999994,0.23125
2361,when they say the coronavirus hates hot and humid weather &amp; you live in southern louisiana.,24,0.12878787878787878,0.45
2362,i saw a woman loading tons of toilet paper into the back of her suv at the grocery store today. is this what happens when shit hits the fan? #coronavirus,10,-0.07777777777777778,0.26666666666666666
2363,#wuhan #china streets remain empty amid #coronavirus outbreak #covid19 #covidー19,55,-0.1,0.5
2364,"for those asking what medicare for all would mean for treating coronavirus, here’s a start.",122,-0.3125,0.6875
2365,remote working due to the corona virus could end up showing businesses that devs sat alone at home with a computer and an internet connection could produce better than being sat in an office with some middle manager constantly interrupting them.,134,0.05500000000000001,0.2816666666666666
2366,theres a coronavirus patient at my moms job wtf,5,-0.5,1.0
2367,"2 great hours of tv tonight: @andrewzimmern what’s eating america at 9 on the insidious practice of making sure some votes don’t even get cast, and @richardengel outbreak at 10, on the front lines of the war against coronavirus. important and scary @msnbc",16,0.30000000000000004,0.9097222222222222
2368,china's communist party dictatorship is now fostering the insinuation that #covid19 originated in america. #iwfp #freehongkong #coronavirus,550,0.0,0.0
2369,"bloomberg is going to expose the crimes of trump’s kids and their significant others. if they sue bloomberg, it will lead to discovery in court. it’s going to get exciting. bill gates is helping with corona virus test kits. the billionaires are using their $to save us.",8,0.3375,0.8375
2370,update from #unmc the clinical trial they're referring to is for the anti viral drug #remdesivir which was used on the 1st confirmed #coronavirus case in the u.s. [he made a full recovery] #covid19 #biocontainment #omaha,8,0.375,0.775
2371,ted cruz said he shook hands with a person who later tested positive for the coronavirus.,7,0.11363636363636363,0.2727272727272727
2372,shit like this angers me so much. chinese people (and other asians) are constantly associated with the coronavirus bc there are people out there who think xenophobia and racism are a joke. pic.twitter.com/sm83whjjwj,11,-0.08125,0.3770833333333333
2373,i have never felt more seen nor more prepared to hand wash effectively. can’t wait for my toddler to learn some of the musical theater classics while fighting flu and #coronavirus.,9,0.4,0.45
2374,"in answer to a question two new #coronavirus cases have been reported in lanarkshire, with an increase of one case in lothian, greater glasgow and clyde, and grampian, #scotland. people who have tested positive for coronavirus here now stands at 1. this is a very dangerous virus",3,0.020909090909090905,0.625
2375,people. toilet paper will not help you with the coronavirus...,41,-0.03333333333333333,0.0
2376,cdc orders several los angeles airport screeners to self-isolate for 14-days after at least 2 co-workers were infected with #coronavirus by passengers who passed temperature checks to screen for #covid19.,17,-0.15,0.2
2377,"all i’m saying is this, if you want to beat the coronavirus, just give everyone a months free subscription to wow classic. nobody will leave their room. you’re welcome.",1,0.3666666666666667,0.7166666666666667
2378,ted cruz just did a press release and has self quarantined since he spoke with and shook hands with the corona virus patient from cpac. matt schlapp also had direct contact with him and then shook hands with trump,6,0.1,0.4
2379,"who was the individual that touched you, ted? #coronavirus",7,0.0,0.4
2380,coronavirus looking at him like,9,0.0,0.0
2381,".@senrobportman trump’s handlers know he’s not equipped to handle the magnitude of the #coronavirus, so let’s suppress the numbers, limit widespread access to tests, and minimize information to the public. you and the gop are just hoping this will go away. guess again, rob.",6,0.0,0.06666666666666667
2382,and boom . he got the corona virus,3,0.0,0.0
2383,4 french mps hospitalized with coronavirus; large public gatherings banned nationwide,22,0.07142857142857142,0.16507936507936508
2384,tfw you give coronavirus to all the top players so you can finally get top 8 at a local,2,0.25,0.5
2385,"an easy way to prevent coronavirus: when you turn on a faucet, use your mouth so you don’t get germs on your hands!! rt to save a life",6,0.6770833333333335,0.8333333333333334
2386,hey @realdonaldtrump is the #coronavirus still a fake news media hoax? or will you be visiting @gop @sentedcruz while he's home self-quarantined?,8,-0.5,1.0
2387,love to see that coronavirus has not stopped teen boys from chewing on their fucking hoodie cords in public like a 5 year old child with a binky,2,5.551115123125783e-18,0.3333333333333333
2388,"it's the only way to distract him from the stock market, coronavirus, and kju firing missiles.",7,0.0,1.0
2389,why aren't bethel and their faith healing cohorts resurrecting all these people who have died from the corona virus?,30,0.0,0.0
2390,this the same type of person to say the coronavirus is such a scorpio,20,0.0,0.3125
2391,"nothing would be more ironic than trump, pence and the gop leadership (the group most affected - all old men) coming down with coronavirus from exposure at cpac after declaring it a ""democratic hoax""",14,0.22888888888888886,0.47777777777777775
2392,"trump doesn't have a plan the grand princess with at least 21 people infected with #coronavirus — is docking in oakland monday. trump doesnt know what to do with the ship’s more than 3,500 passengers who may have been exposed. #onevoice1 #covid19",49,0.2333333333333333,0.6333333333333333
2393,!!!!!!!!!!!!!!! washington (ap) — gop sen. ted cruz staying at home for 2 weeks after shaking hands with man who tested positive for coronavirus.,93,0.22727272727272727,0.5454545454545454
2394,"seen elsewhere, worth the share #panicbuying #coronavirus #coronavid19",131,0.3,0.1
2395,the coronavirus has announced that it is self-quarantining after possible exposure to ted cruz,7539,0.0,1.0
2396,"why didn't trump use the coronavirus test from the who? in 2016, trump had investments in thermo fisher scientific corp &amp; v.f. corp, producing tests for the us investments don't show on his 2018-19 list, trust, ivanka $unknown. #onevoice1 #wtpteam",22,-0.1,0.6
2397,"#thoughtsandprayers hey, i thought coronavirus was a democratic hoax?",61,0.0,0.0
2398,"x22: latest news on coronavirus. biden sanders race, michelle, hunter, ukraine, assange, crowdstrike, roger stone. mueller report falling apart. funding $3b foreign aid traced. it will be hot summer. nothing can stop whats coming.",161,0.20833333333333334,0.625
2399,"no. you aren’t. because eventually every hospital will be full. and this will effect everyone, whether you have coronavirus or break a leg. you do not want it to happen. and you do want to do everything possible to decrease spread.",2,0.175,0.775
2400,what a dope! nolte: bette midler attacks trump for not wanting ‘america’s coronavirus numbers’ to ‘go up’ http://bit.ly/2izpvjz via @breitbartnews,36,0.0,0.0
2401,"the coronavirus has brought some fear and it’s understandable. however, there are ways to protect yourself and your family. please watch the video for tips to keep you safe and stay informed on the status of the disease.",41,0.5,0.5
2402,"this coronavirus is affecting us in some way. i want to do what i can to help you out. so here's the deal, if your business has been impacted in some way, reply below. i'll work my way through every response to see how i can support or connect you with someone that can.",42,0.0,0.0
2403,"trump & the @gop’s response to coronavirus “take 2 tax cuts, roll back some regulation &amp; call us in the morning.”",24,0.0,0.0
2404,leave it to republicans to propose tax cuts to combat coronavirus. it’s their solution for everything.,226,0.0,0.0
2405,"at the biden event in detroit, there’s a man whose sole job is to dollop hand sanitizer onto people’s hands. #coronavirus",84,0.0,0.25
2406,freaked out americans are hoarding supplies in mass #breaking #coronavirus #news,36,0.0,0.0
2407,the unprecedented measures cover the entire mediterranean nation of more than 60 million people. #coronavirus #ncov,19,0.3666666666666667,0.6749999999999999
2408,excellent example of #mansplaining. two men with no medical qualifications telling us why the female doctor on #cblive is out of her depth. #cblive #coronavirus,31,0.3333333333333333,0.3888888888888889
2409,"the coronavirus pandemic will substantially reduce economic growth this year. worse, it will likely increase poverty. in times of sharp economic slowdown, it is the poor who are hurt the most and have the least means to buffer the strain on their basic consumption needs. #covid19",140,-0.036111111111111115,0.4861111111111111
2410,three new coronavirus cases in the coachella valley have been reported,300,0.13636363636363635,0.45454545454545453
2411,the coronavirus was actually created in order to attempt to stop st. patrick's day on ezra avenue. a conspiracy theory.,47,0.0,0.1
2412,corona virus is not a joke. stop making fun and memes about it. let us all pray for the world.,34,0.3,0.2
2413,berkshire medical center staff at pittsfield hospital are in quarantine amid rising number of patients with coronavirus in western massachusetts.,18,-0.03333333333333333,0.03333333333333333
2414,democrats support open borders. how does that mesh with their daily freakout demands that president trump contain #coronavirus?,24,0.0,0.25
2415,stop panicking #thestory #tucker #hannity #tcot #ccot #kag #trump #covid2019 #coronavirus,551,0.0,0.0
2416,the same democrats who demand only doctors speak dispense #coronavirus advice attn doctor schumer: people who threaten the lives of #scotus judges don't get to lecture us &amp; lie about #presidenttrump protecting the safety of the american people,122,0.0,0.375
2417,the economic impact of the coronavirus will be large not because the outbreak is large (we’ve seen larger epidemics before) but because we are (rightly) taking more precautionary actions than ever. this will send waves through the economy. urgently need plans to neutralize them.,11,0.23571428571428568,0.43214285714285716
2418,there aren't enough #coronavirus tests to go around because the trump admin is incompetent.,27,-0.175,0.43333333333333335
