,Text,retweets,polarity,subjectivity
1177,"oh i feel so terribly sorry for them. hong kong — the threat of spreading the coronavirus has forced catholic officials in hong kong to suspend all church programs feb. 15-28, including sunday masses and the ash wednesday liturgy that marks the beginning of lent.",6,-0.26666666666666666,0.43333333333333335
1178,"“stop coronavirus? we can barely diagnose it ... unfortunately, diagnostic efforts often reap less profit and get less funding than drug research.” - @bopinion #covid2019 https://www.bloomberg.com/opinion/articles/2020-02-13/coronavirus-case-surge-shows-need-for-better-diagnosistic-tools",14,-0.19583333333333333,0.30833333333333335
1179,"as cases of the coronavirus (dubbed 2019-ncov) across the globe increase, so does misinformation. set the record straight with @ala_booklist's reading recommendations about outbreaks, viruses &amp; vaccines.",12,0.2,0.4
1180,why the number of novel coronavirus cases just jumped,20,0.0,0.0
1181,"if you get cable tv, every night at 7 pm on cnbc, the business channel, they have a show on the coronavirus, giving the days stats on infections &amp; deaths, and where the virus is spreading. it's an excellent show. every night at 7 pm.",11,1.0,1.0
1182,"breaking: china's hubei reports 4,823 new coronavirus cases and 116 deaths on february 13. note this is a big drop from yesterday's 14,890 number. this is the second set using the number counting method. follow updates here",15,0.04545454545454545,0.18484848484848485
1183,"royal caribbean cancels 18 cruises, warns novel coronavirus likely to impact earnings http://dlvr.it/rq0hnw",8,0.0,1.0
1184,this is crazy everyone knows the only cure for coronavirus is a @mattchandler74 steak,2,-0.3,0.95
1185,"circular quay: a man on board the norwegian jewel is reportedly being tested for possible coronavirus. the cruise ship has temporarily been placed into lockdown. the ship has a 2,376 guest capacity, with more than 1,000 crew. https://7news.link/2shncup #coronavirus #7news",16,0.16666666666666666,0.5
1186,"china's hubei province has reported 4,823 new coronavirus cases",11,0.13636363636363635,0.45454545454545453
1187,"surprise surprise, the passenger tested positive once they left nz. how long was this infected passenger wandering around little old new zealand, while infected with the bloody coronavirus? why did we not pick it up at the border???",7,-0.0819805194805195,0.4285714285714285
1188,"dozens of britons evacuated from the virus-stricken chinese city of wuhan a fortnight ago were released from quarantine, thursday, february 13. china reports huge spike in new coronavirus cases, 254 more deaths https://www.voanews.com/science-health/coronavirus-outbreak/china-reports-huge-spike-new-coronavirus-cases-254-more-deaths",15,0.2590909090909091,0.4636363636363636
1189,"hubei province coronavirus 4,823 new cases and 116 new deaths - state media",6,0.13636363636363635,0.45454545454545453
1190,"i’m just testing it all for coronavirus, sweetie. it’s called public safety.",5,0.0,0.06666666666666667
1191,"breaking: epicenter of coronavirus outbreak reports 4,823 new cases and 116 new deaths",743,0.13636363636363635,0.45454545454545453
1192,rumor has it they're building an underground bunker in barbados for the trudeau's to wait out the coronavirus. i should know. i started the rumor. #trudeaumustgo,25,0.0,0.0
1193,"in responding to the coronavirus, the us should apply lessons learned from past transnational threats. but, lisa monaco writes here, the federal government in important respects is unfortunately moving in the wrong direction:",40,-0.2125,0.7875
1194,just in china finally admitted that they were welding entire apartment buildings shut by announcing their intention to tighten epidemic controls by sealing entire residential complexes and only allowing essential vehicles on roads. #coronavirus,165,0.0,0.71
1195,the risk of transmission of #coronavirus remains low in la county but it's always smart to practice good hygiene: -wash with + for at least 20 seconds -avoid touching your -avoid contact with people -cover your cough &amp; sneeze with a tissue,29,0.22285714285714286,0.4885714285714286
1196,"at the #aaas2020 briefing on the coronavirus, scientist gets asked if he reads journalist stories about the virus. ""i read @statnews"" he answers. (which means the amazing @helenbranswell!)",7,0.7500000000000001,0.9
1197,soo i went to the doctor today because i been feeling horrible he told me i don't have the flue or coronavirus thank god but i have a bacteria or a virus im staying home until i get better :( and ofcourse i will keep smiling no matter what,10,-0.4166666666666667,0.8333333333333334
1198,update | health ministry reports that the samples from the two remaining jamaicans in isolation have returned negative for the #coronavirus. the jamaicans recently came back to the island after visiting china.,58,-0.09999999999999999,0.21666666666666667
1199,"#uk #coronavirus a person attending a central london conference w/ 200+ others last week has been diagnosed with #covid19 the individual attended the uk bus summit at the qeii centre, one of london’s largest conference halls, in westminster on feb 6 h/t @flutrackers",160,0.0,0.2388888888888889
1200,"president* trump solutions to “corona” virus: let the april “heat” heat kill it nuke it like a hurricane cross it out with a president* trump sharpie, aka “trumpie” put tariffs on corona beer and win the trade war against the virus very stable genius at work.",52,0.3333333333333333,0.2333333333333333
1201,ok folks: apparently the coronavirus is much much worse then we ever suspected! cats are wearing coronavirus masks in china | fox news,42,0.01666666666666668,0.48333333333333334
1202,more than 3 million #uyghurs and other turkic people in #china’s concentration camps now face the risk of dying by starvation and #coronavirus.,36,0.1875,0.4375
1203,the head of the imf says global central banks and governments may need to unite to fight the economic fallout from the coronavirus.,54,0.06666666666666667,0.15
1204,"during this #coronavirus epidemic in china, we see more and more long lines forming across the entire country. they’re running low on food and supplies. if the world’s second largest economy can’t handle covin19 disaster, what about other countries?",94,0.11785714285714285,0.3857142857142857
1205,"#vietnam announced it has blocked one #cruiseship from docking over fears of the #coronavirus that is sweeping through #china, according to state media outlets. it isn’t clear if there are any confirmed cases of #covid19 onboard the ship.",48,0.25,0.6916666666666667
1206,"masks are so scarce in wuhan that doctors and nurses are using tape to patch them up. chinese medical workers at the forefront of the fight against the coronavirus epidemic are now becoming its victims -- 1,716 infected, 6 dead. w @chubailiang @amyyqin",370,0.0625,0.3125
1207,let’s be honest is there anyone out there besides @jeremycorbyn that would coronavirus and racism in one sentence?,116,0.6,0.9
1208,"hmm. you mean cities w/ major airports and commercial ports, centers of international trade/travel, w/ strong commercial and manufacturing ties to large firms and industries worldwide? yeah, those places are likely to see coronavirus before it gets to east bumblef*ck county",5,0.04970238095238094,0.4186755952380952
1209,"it’s “apocalyptic,” shanghai-based photographer nicoco says about the desolate chinese streets amid the coronavirus outbreak. our special report airs tonight at 7 p.m. et. https://cnb.cx/3bb9ago",41,0.17857142857142858,0.2857142857142857
1210,coronavirus spreads to egypt as country confirms africa's first case #coronavirusoutbreak,174,0.25,0.3333333333333333
1211,i love being the scientist who created coronavirus (pronounced “quranavirus”) designed to turn everyone muslim. the @who knows all about this and even funded me to do this because they were scared of breaching their diversity quota,101,0.5,0.6
1212,"netanyahu admits meddling in us politics, #israel attacks #syria &amp; more on coronavirus as a bioweapon https://youtu.be/xpuur6apgxo via @tlavagabond",40,0.5,0.5
1213,"gp surgeries in luton, portsmouth, farnham, islington and taunton have all closed in the last 24 hours over #coronavirus fears. seriously, if you've just returned from asia and are feeling flu-like call 111. do not go to the gp!",11,-0.1722222222222222,0.27777777777777773
1214,"just to remind @jeremycorbyn why he lost an election, imagine putting coronavirus and racism in one sentence. you’re the racist here, because when i hear about coronavirus i don’t think of chinese people because this is now a global threat.",12,0.0,0.0
1215,"hong kong : the 54th #coronavirus case of hk developed cough on february 3, but sought medical help just two days ago. that's 10 days of not knowing about carrying the virus, and 10 days of possible spreading.",23,0.03333333333333333,0.43333333333333335
1216,"if you’re freaking out about coronavirus and haven’t gotten a flu shot this year take a moment to ponder your own risk assessment skills. 26 million illnesses, 250,000 hospitalizations and 14,000 deaths in the us this season from influenza via @cdc.",27,0.6,1.0
1217,let us count the ways the trump administration is underprepared to tackle the coronavirus,50,0.0,0.0
1218,when there’s love and the coronavirus in the air pic.twitter.com/vup67uvcwh,9,0.5,0.6
1219,"when xi jinping staked his claim as ""leader for life,"" he did so on the promise that he would ensure the health, wealth and security of china’s 1.4 billion people. his government’s failed response to the #coronavirus has given lie to that social contract",962,-0.23333333333333334,0.18333333333333332
1220,i'm saying we should bite the coronavirus's ear. that shows dominance,1,0.0,0.0
1221,https://www.bbc.com/news/world-asia-china-51486106 #whereisfanbin #whereischenqiushi .@mfa_china .@chinamission2un .@zlj517 they called for #resistance they #exposed #truth re: #coronavirus #officials made them #retractstatements they are #missing #dotherightthing #help #exposethetruth,36,-0.2,0.05
1222,‘it's meant to help’: harvard professor responds after government dismisses study on undetected coronavirus cases #jakpost,22,0.0,0.0
1223,"new study led by @mlipsitch: ''we found that the ability to detect imported cases among high surveillance countries is 40%, among intermediate surveillance countries it is 37%, and among low surveillance countries it is 11%'. #coronavirus",13,0.0987878787878788,0.43151515151515146
1224,"given the alarming headlines about the #coronavirus outbreak and the consumption of wildlife, the tradition of so-called wet markets now faces harsh scrutiny. but eating wildlife is not the only way diseases can spread from animals to people. http://bit.ly/2uovzw0",7,-0.1,0.675
1225,"a lot of coronavirus panic/conspiracy articles have this vibe of ""could it break out of china and start infecting real people?"" and i hate it",2,-0.30000000000000004,0.6000000000000001
1226,"check out my genius of a big brother, ⁦@mattfrieman⁩ in the ⁦@washingtonpost⁩ “us scientists study #coronavirus to combat covid-19 outbreak” - the washington post. #baltimore ⁦@ummc⁩",3,0.0,0.1
1227,"hubei province (wuhan) confirmed #coronavirus cases supposedly fell today from 4.8k to 2.4k today...but the city is now on increased ""wartime measures"" where you can't even leave your home except for extreme reasons. @huxijin_gt how do you shill propaganda w/ a straight face?",7,0.09375,0.625
1228,"china’s doctors, fighting the coronavirus, beg for masks http://a.msn.com/01/en-us/bb100yng?ocid=st2",10,0.0,0.0
1229,cambridge students told by racists to go back to own country amid coronavirus racism directed towards east asian students studying at elite cambridge university has increased amid the global coronavirus outbreak,21,0.15,0.25
1230,fifth case of coronavirus reported in british columbia | vancouver sun “she came home from shanghai through yvr and travelled by private vehicle to her home in the interior” the flights from china to vancouver continue every single day. #coronavirus,6,-0.023809523809523808,0.19642857142857142
1231,"#quarantine day 10. happy valentine's day! i did not take this picture, i just think it is perfect for this special day. so grateful for the love and support i received, thank you. i am a better person after this, i wish the world is a better place as well. #coronavirus",5,0.6428571428571429,0.6952380952380951
1232,"i'm not *currently* concerned about wuhan coronavirus in sf, but i *did* make sure my emergency kit was up to date with food, water, and masks. the virus could easily take hold in sf, especially with our poor public sanitation. this is irresponsible journalism from recode.",1,0.08888888888888889,0.6314814814814815
1233,"the coronavirus epidemic is a threat to our global economy as well as our public health. an integrated supply chain is the backbone of our economy in michigan, and i am increasingly concerned by the potential effects of this crisis on our manufacturers.",6,0.0,0.35555555555555557
1234,"the county health and human services agency, centers for disease control and prevention and local hospital representatives will give an update on covid-19, the novel coronavirus today at 4 p.m. we will live tweet the update.",16,0.04545454545454545,0.19999999999999998
1235,um.... cats are wearing coronavirus masks in china | fox news,2,0.0,0.0
1236,".@cdcgov is ramping up its response to the coronavirus outbreak by establishing 5 u.s. labs where those with flu-like symptoms can be tested. in wuhan, officials have adopted draconian measures in hopes of stopping the spread. here’s @carterevans https://cbsn.ws/31uelul",20,0.0,0.0
1237,patient in wuhan's makeshift hospital records video to thank health care workers on frontline of novel #coronavirus fight,12,0.0,0.0
1238,"local, state leaders hold panel at ku to dispel myths about coronavirus. more:",5,0.25,0.25
1239,singapore’s pm lee doing a good job in reassuring citizens amid the #coronavirus crisis,5,0.7,0.6000000000000001
1240,"doctors in 5 us cities will begin testing patients with flu-like symptoms for the new coronavirus, covid-19, the cdc says. https://nbcnews.to/39ewnrl",79,0.13636363636363635,0.45454545454545453
1241,"it's not herbal medicine versus vaccination. a holistic approach means they can work together. mint for nausea, jewelweed for rashes, and vaccines for polio, whooping cough, and coronavirus. https://buff.ly/2wjdery",20,0.0,0.0
1242,the rapid spread of the #coronavirus is taking a toll on the $46 billion global ocean #cruise industry. the long-term impact of the virus on the industry is unclear and some analysts have cautioned investors against dumping cruise stocks.,30,0.0,0.0
1243,the health of ibmers is our primary concern as we continue to monitor upcoming events and travel relative to novel coronavirus (covid-19). we are cancelling our participation in this year's rsa conference.,71,0.2,0.25
1244,"egyptian health authorities have said a ‘foreigner’ has been placed in quarantine after being confirmed to have coronavirus, the first official diagnosis in africa.",47,0.325,0.6666666666666666
1245,"on feb. 14, #hubei province, the epicenter of the #coronavirus epidemic, reports: - 139 deaths - 2,420 confirmed cases - 912 recovered and discharged total confirmed #covid19 cases in #hubei at 54,406, with 1,457 dead and 38,107 hospitalized",51,0.15000000000000002,0.7875
1246,"wow, @roundrockisd. fyi, #coronavirus is not caused by being asian or chinese. would rrisd find the need to “disinfect” after a non-asian festival? stand with your #aapi families against unfounded fear.",51,0.03333333333333333,0.3333333333333333
1247,"on february 2, 2020, the first training for novel coronavirus was conducted at the vietnam national children's hospital, garnering the participation of 12,000 physicians at 257 sites using @projectecho, a telementoring model aimed at health system strengthening. #coronavirus",20,0.25,0.3333333333333333
1248,"coronavirus update: - 66,887 cases worldwide - 10,109 suspected cases - 1,523 fatalities - 10,757 in serious/critical condition - 7,720 recovered - most cases in china - today: first case in egypt - 26 countries reporting cases",1024,0.375,0.41666666666666663
1249,"we can argue about whether ibm and fb canceling events in sf due to coronavirus is an overreaction, but i’m definitely not going to complain about the principle that companies shouldn’t force employees to be exposed to health risks for their jobs.",11,-0.0625,0.4375
1250,"chinese medical workers at the forefront of the fight against the #coronavirus epidemic are now becoming its victims -- 1,716 have contracted the virus, including 1,502 in wuhan. six are dead.",25,0.0625,0.3125
1251,"all of the canadian passengers and their families who were recently evacuated from wuhan, china to a military base in ontario for two weeks of quarantine are currently healthy with none of them exhibiting symptoms of novel coronavirus.",21,-0.1,0.4625
1252,biological warfare!!! #coronavirus,152,0.0,0.0
1253,"“just read that jim baker is selling some tonic for the coronavirus. oh, and it's $300 a bottle”. is this true? scammer.",20,0.35,0.65
1254,china’s president xi was aware of the coronavirus nearly two weeks before he first spoke publicly about it — and while officials at its epicenter in the city of wuhan were still playing down its dangers.,44,0.08888888888888888,0.2677777777777778
1255,"one of the westerdam passengers that disembarked in sihanoukville, cambodia has tested positive for the coronavirus. cambodia pm hun sen, age 67, personally greeted passengers there, shaking their hands. https://www.bloomberg.com/news/articles/2020-02-15/american-passenger-on-westerdam-cruise-contracted-coronavirus",175,0.11363636363636363,0.42272727272727273
1256,"even if the coronavirus pandemic passes quickly, there will be another one, possibly far more catastrophic. if we have any hope of containing it, the time to prepare is now.",108,0.3111111111111111,0.6666666666666666
1257,** exclusive corona virus report ** personal friend provides this anonymous report from china: “yes everyone is being ask to work from home. yes my compound has a guard at the door that scans your temperature before you come in.” continued in comments...,136,0.0,0.3
1258,"i wonder if locking people in their apartments to die-in-place is what #who meant when they said if china’s coronavirus containment efforts were working, other countries should consider using them. — #covid19 #ahemhealth",68,-0.125,0.375
1259,"our economy is battered by fires, floods and coronavirus. our transformation to zero carbon in energy/transport will require a massive economic stimulus, creating regional jobs. c’mon australia: wind/solar/hydro + robust grid; co2 sequestration in agriculture. we can do it.",109,0.1,0.6
1260,"it seems the economy, rail blockade, coronavirus and the huawei disaster is no longer in trudeau's job description. he created a disaster and he's on the run with no idea how to regain control. there is not a competent liberal mp to be found.",557,-0.25,0.6666666666666666
1261,"koharu asked junjun about the coronavirus. junjun's doing fine, but she's pretty much stuck at home and only goes out with a mask. it warms my heart knowing these two are still talking.",51,0.21666666666666667,0.675
1262,"i’m old enough to note roughly every 7-10 years there’s some virus scare that media pins on e asian (specifically chinese) people. let’s see, i remember bird flu, sars, swine flu and now coronavirus. it just seems weirdly set up to coincide with rising hostility against china...",31,-0.08333333333333333,0.35000000000000003
1263,#coronavirus life hack,177,0.0,0.0
1264,corona virus protection. added benefit .. no one knows who the hell you are,116,0.0,0.0
1265,"the asian american journalists association asks the media to be mindful of photos, context and word choice surrounding coronavirus. ""aaja warns against blanket use of chinatown images that reinforce stereotypes and create a sense of 'otherness.'""",18,0.0,0.0
1266,the coronavirus shows the chinese government prioritizing self-preservation and the censoring of information that is perceived as embarrassing--such as this doctor's early warning of the outbreak--even at the expense of the chinese people's public health.,49,0.025,0.09166666666666666
1267,wandering ship becomes 'best cruise ever' despite coronavirus fears https://reut.rs/2htm2ae,19,1.0,0.3
1268,"death toll from coronavirus epidemic exceeds 1,600",97,0.0,0.0
1269,"wow. i feel like everybody should watch and share this video, just so her sacrifice isn’t in vain. these poor people. #coronavirus #covid19",49,-0.15000000000000002,0.8
1270,"here comes the kicker -- if you are not killed first time around by #coronavirus #covid19 then you get killed second time around. ain't that a ""noble"" contribution of #china to #global demise?",10,0.125,0.20555555555555557
1271,family of britain’s youngest suspected coronavirus victim struggling to cope after five days in quarantine #corvid19,15,-0.07500000000000001,0.05
1272,"total coronavirus cases breach 69,000 worldwide, deaths at 1,666",17,0.0,0.75
1273,"hubei doctors warn of even deadlier coronavirus reinfaction causing sudden heart attacks - “when they get it the 2nd time, the antibody doesn’t help but make it worse, &amp; they die a sudden death from heart attack.”",60,-0.1,0.4
1274,"#coronavirus #covid19 cases by country: 68,339 &amp; 1,662 dead 338 &amp; 1 dead 72 56 &amp; 1 dead 34 28 22 18 16 16 15 15 12 &amp; 1 dead 10 9 8 8 3 &amp; 1 dead 3 3 2 2 1 1 1 1 1 1 1 tot 69,036 &amp; 1,666 dead",31,-0.19999999999999998,0.39999999999999997
1275,"new york times: ""some experts worry as a germ-phobic trump confronts a growing epidemic"" nyt, since when is hating germs an impediment to fighting a deadly virus? #coronavirus #travelban #iwfp",7,-0.03181818181818183,0.42727272727272725
1276,us military preparing for potential coronavirus pandemic: report | thehill http://dlvr.it/rq6hv0 #wuhanpneumonia #coronavirus #covid19,26,-0.05,0.55
1277,"after an earlier report of a 22 day incubation period in shanghai, now confirmation of a 24 day incubation period in shandong. today a family tested positive for #coronavirus 10 days after quarantine ended. #covid19 #coronavirusoutbreak #ncp #ncov2019",25,0.11363636363636363,0.5227272727272727
1278,"oakland mayor libby schaaf encourages people to support businesses in chinatown. “we recognize there are many false rumors, many fears and that this is hurting our businesses.” oakland has no confirmed cases of the coronavirus. @christies_nbc",5,0.09999999999999996,0.65
1279,china coronavirus outbreak: all the latest updates,32,0.5,0.9
1280,"egypt has identified its first case of #coronavirus, according to the ministry of health and population and the world health organization (@who). https://arab.news/papmm",8,0.25,0.3333333333333333
1281,"the coronavirus death toll surpasses 1,600. but we're told that everything is 'under control'. #covid2019 #coronavirus #cascadingeffects",5,0.0,0.0
1282,france reports first coronavirus death outside asia http://hill.cm/tcsxho9,13,0.125,0.19166666666666665
1283,"with china's supply chains cut off by the coronavirus outbreak, multinational companies are moving production outside the country or looking for alternative sources for parts. some of these moves could be permanent.",4,0.0,0.05
1284,follow @klaytnpx or i will die from mental breakdown plis help i need klaytn to hit 1000 followers or we will all have corona virus px the gang i'm not in the gang follow @klaytnpx 4 president thanks @klaytnpx @klaytnpx @klaytnpx @klaytnpx,3,0.05,0.2
1285,"in an interview at the chinese embassy, ambassador cui tiankai, says china is working hard to fight the coronavirus and is accepting help from foreign experts. #coronavirus @ambcuitiankai https://newsus.cgtn.com/news/2020-02-16/chinese-ambassador-says-foreign-experts-welcome-in-coronavirus-fight-o7wdbprvxc/index.html",22,-0.1388888888888889,0.2222222222222222
1286,chinese experts have called upon cured patients who were infected with novel #coronavirus (covid-19) to donate plasma at hospitals as neutralizing antibodies have been identified in the plasma of some patients,12,0.0,0.0
1287,"laurie garrett is highly respected, followed china & public health for years and does not reach conclusions lightly. — as the deadly coronavirus began to spread, beijing wasted the most critical resource to fight it: trust.",11,0.09428571428571429,0.42952380952380953
1288,u.s. woman tests positive for coronavirus after disembarking from cruise ship,29,0.22727272727272727,0.5454545454545454
1289,guo’s remark in 90 seconds: ccp’s coronavirus and national conferences https://gnews.org/114626/ via @gnews202064,17,0.0,0.0
1290,"helping out: @jccraves runs boston chinatown tours. when area businesses do well, she does well. so she’s starting a “dinner series” to help the chinatown ecosystem thrive again. #dinewithchinatown #boston #chinatown #coronavirus",9,0.0,0.1
1291,"millions of people across asia are working hard while sequestered away at home due to the #coronavirus in what may be the single largest work-from-home experiment in history, @aaronreich reports.",27,-0.1626984126984127,0.376984126984127
1292,"on feb. 15, #hubei province, the epicenter of the #coronavirus epidemic, reports: - 139 deaths - 1,843 confirmed cases - 849 recovered and discharged total confirmed #covid-19 cases in #hubei at 56,249, with 1,596 dead and 39,447 hospitalized",53,0.15000000000000002,0.7875
1293,"coronavirus spread from a science laboratory in wuhan and not a ‘wet market', a group of chinese scientists have sensationally claimed.",34,0.2388888888888889,0.35555555555555557
