,Text,retweets,polarity,subjectivity
3309,why are some in the msm & certain dem governors afraid of @realdonaldtrump’s #righttotry approach to the #coronavirus? would they rather you die waiting than thank trump for saving your life? .@john_di_lemme &amp; i discuss on @cbjrealnews: https://conservativebusinessjournal.com/podcast/right-to-try-coronavirus/,26,-0.19285714285714284,0.7357142857142858
3310,"coronavirus, ever since they went tour they’ve been soo annoying",10,-0.8,0.9
3311,"italy records 969 new coronavirus deaths, its highest daily figure, bringing the total deaths in the country to 9,134 #coronalockdown",151,0.04545454545454545,0.40151515151515155
3312,we still outside... corona virus won’t stop us from fucking @libertinefae full video - https://onlyfans.com/gibbytheclown pic.twitter.com/fraaubirl0,627,-0.08333333333333333,0.46666666666666673
3313,the location data of #smartphones that were on a florida beach during spring break and where those phones traveled @irmaraste @evirahealth #coronavirus #covidー19 #covid19 #coronaviruspandemic #stayhome #staysafe,93,0.0,0.0
3314,"#breaking a doctor at riverside medical clinic on day st tested positive for #coronavirus, exposing just over 100 patients and staff. almost all of those people have already been contacted, and will be tested this weekend just as a precaution.",39,0.11363636363636363,0.2727272727272727
3315,democrats convinced themselves the coronavirus would be the end of president trump. turns out--it's his shining moment.,3983,0.0,0.0
3316,"#sweden similar to italy, usa etc - looks like #coronavirus complications seriously linked to hyperinsulinemia/ir/diabetic dysfunction (cvd, hypertension etc.)",90,-0.16666666666666666,0.5333333333333333
3317,"actually, it's 60% that approve of trump's handling of the corona virus issue, per gallup;",14,0.0,0.1
3318,excellent essay by one of the world's foremost coronavirus experts on how to address the pandemic through public policy.,38,0.5,0.5333333333333333
3319,i really thank nana addo for adding kasoa to the lockdown areas was there yesterday and people were doing everything normal as if they’ve not heard about the corona virus.. no nose mask no gloves few people with sanitizer and the place was choked as usual,9,-0.02500000000000001,0.29999999999999993
3320,"“if you’re healthy and you know it wash your hands (scrub scrub) if you’re healthy and you know it wash your hands (scrub scrub) cuz we’ve got coronavirus and we all don’t want to die-rus if you’re healthy and you know it wash your hands (scrub scrub)” - me, alone, unprompted",2,0.5,0.5
3321,call it off until the coronavirus crisis is over.,14,0.0,0.0
3322,may the corona virus not hit home,4,0.0,0.0
3323,we made usa today! holy shark! ‘baby shark’ reworked for the coronavirus to help teach good hygiene,2,0.7,0.6000000000000001
3324,president trump said there are certain parts of the country that will not be ready to return to a semblance of normalcy when his administration’s 15-day guideline to stem the spread of the new #coronavirus expires next week.,4,0.13766233766233765,0.3814935064935065
3325,"@nygovcuomo @nycmayor ""nyc has let a murderer out of jail. think about the victim’s family. they also will not alert ice that he is released. logic no longer prevails here."" #coronavirus #nyc",17,-0.08750000000000001,0.025
3326,boeing offers the use of its dreamlifter cargo planes in #coronavirus fight #covid19 #boeing #avgeek #coronavirusoutbreak https://twitter.com/boeing/status/1243660810737549312,11,0.1,0.0
3327,"an alaskan has passed from complications due to the new coronavirus, the alaska native medical center said in a release on friday.",14,-0.022159090909090913,0.23238636363636364
3328,"be aware of bullshit fake news on whatsapp: coronavirus, doctors from vienna and 'killer' ibuprofen | health24 https://m.health24.com/medical/infectious-diseases/coronavirus/fake-news-on-whatsapp-coronavirus-doctors-from-vienna-and-killer-ibuprofen-20200324",20,-0.125,0.625
3329,nancy pelosi's not celebrating 80th birthday amid coronavirus ‘until i can hug my grandbabies’,14,0.0,0.0
3330,"lmao! @mayorcantrell, local events are your responsibility! how did this idiot get elected? seriously? hope you’re ready to #votered #nola, #neworleans #louisiana #la new orleans mayor blames trump for not shutting down mardi gras over coronavirus",13,-0.02893217893217894,0.53001443001443
3331,"as toilet paper has become a scarce commodity in the coronavirus pandemic, people increasingly have turned to wipes. now those wipes are getting flushed down toilets -- seriously, do not do that -- and clogging sewer systems. @wamu885",287,-0.007407407407407418,0.3185185185185185
3332,the best genre of coronavirus post is “i can’t believe the greatest country on earth sucks ass???”,8,0.5666666666666667,0.5333333333333333
3333,"webinar “#coronavirus - holding our breath"": dr. natalia freund of #israel’s @telavivuni sackler faculty of #medicine explains how her lab is searching for a vaccine and treatment for #covid19 watch here https://youtu.be/w6uivwkj2w4 #stayhome",23,0.0,0.0
3334,"mixed feelings of terror and tedium that many people are feeling during the coronavirus pandemic is called ""plague dread.""",6,0.25,0.375
3335,i love goooooold!!! #pokemon #pokemontcg #pokemongo #pokemonday #pokemonswordandshield #goldpokemon #rarecard #secretrare #corona #coronalockdown #coronavillains #coronavirus,2,0.9765625,0.6
3336,trump is trying to ban this ad about his coronavirus response so please don't share it,27,0.0,0.0
3337,absolutely shameful nytimes oped blames coronavirus pandemic on american christian conservatives,11,0.06666666666666667,0.3
3338,"breaking: due to the coronavirus i will be postponing my 23rd birthday until further notice. for the time being i will remain 22. thank you for your cooperation, and god bless.",0,-0.0625,0.4375
3339,"how to tell the difference between allergies, the flu and coronavirus",16,0.0,0.0
3340,the ad showed a steep graph of growing coronavirus cases along with audio of trump’s statements about the pandemic.,15,0.0,0.0
3341,who qualifies for the coronavirus stimulus payments?,19,0.0,0.0
3342,"iowa has deployed 90 members of the national guard for #coronavirus support, but pandemic has resulted in just about 100 hospitalizations in the state. that ratio is, um, something.",64,0.0,0.0
3343,just had a private message telling me to expect several more senior tories to announce they have #covid19 over the weekend and they shall all be working from behind closed doors the person claims to have strong sources we shall wait and see. #coronavirus,145,0.0722222222222222,0.40138888888888885
3344,"just in: coronavirus news: nyc reports 84 new covid-19 deaths, 450 deaths total",27,0.06818181818181818,0.6022727272727273
3345,"thank you democrats for the coronavirus aid, relief &amp; economic security act for the american people!",50,0.1,0.1
3346,sure: i confirm that 51 italian doctors have died after testing positive for the corona virus.,2,0.24242424242424243,0.4781144781144781
3347,a new report raises hope that the blood of recovered patients can help treat severe coronavirus cases https://www.businessinsider.com/coronavirus-convalescent-plasma-treatment-early-chinese-study-results-2020-3?utmsource=twitter&amp;utmcontent=referral&amp;utmterm=topbar&amp;referrer=twitter via @businessinsider,9,0.13636363636363635,0.45454545454545453
3348,the @ihsgov has begun distributing $134 million in new funds to respond to #covid19 in #indiancountry. an additional $1 billion was approved today to support a range of #coronavirus response activities with our tribal &amp; urban indian organization partners. https://www.ihs.gov/newsroom/ihs-blog/march-2020-blogs/coronavirus-ihs-committed-to-patient-care-and-getting-resources-to-front-line/,14,0.06818181818181818,0.22727272727272727
3349,think capitalism is so great? remember this: capitalism is so fragile that it’s already failing apart after just two weeks of americans staying in being couch potatoes to slow the spread of the coronavirus.,31,0.16666666666666666,0.5499999999999999
3350,see here specialist nurses from cuba arrive in st kitts and nevis to assist in efforts to eradicate #coronavirus #covid_19 let’s show our appreciation and unite to end the us government blockade of cuba -solidarity https://twitter.com/pmharriskn/status/1243995947237072897?s=21,122,0.0,0.0
3351,"the duke & duchess of cambridge, alongside phe & the nhs, offer guidance to people struggling with their mental health during the #coronavirus outbreak - to help them cope. ""by pulling together &amp; taking simple steps each day, we can all be better prepared for the times ahead""",48,0.13333333333333333,0.3523809523809524
3352,"a message from a man with #coronavirus our gov's are failing us lockdown should've been 100% (like in #wuhan) for 4 weeks during which massive amounts of icu beds, ventilators &amp; ppe should've been built &amp;then normal life for ppl below 65 could have resumed (small econ. damage)",78,-0.03333333333333333,0.6833333333333332
3353,"cnn: more than 2,000 people have died from the coronavirus in the us as of 7:45 p.m. est saturday, according to a cnn count compiled through data on state health department websites. there are 2,010 deaths reported as of now. the 1,000 death mark was reached thursday.",2284,0.5,0.5
3354,"new resources are updated regularly! do you need food, housing, financial, legal, mental health resources, internet, diapers, or other assistance? there are a growing number of #covid19 #coronavirus resources available for you! go to http://ready.nola.gov/assistance",32,0.08733766233766234,0.24378121878121878
3355,we gone redo spring break miami 2k20 over when coronavirus is over rt &amp; comment if you wanna redo spring break,11,0.0,0.0
3356,"- total cost of coronavirus relief bill:$2 trillion - $1,200 per american - multiply 1200 by 330 million americans gives us $396 billion - 2 trillion minus 396 billion equals 1.64 trillion - that's $1.64 trillion actually coming out of taxpayer pockets, or $5000 per american.",242,-0.016666666666666666,0.15833333333333333
3357,"un donates 250,000 face masks to new york city. the city reports nearly 30,000 #covid19 cases &amp; over 500 deaths http://xhne.ws/uw1qc #nyc #coronavirus",25,0.11818181818181818,0.42727272727272725
3358,"video: a special light show at the eiffel tower pays tribute to france's healthcare workers, who are on the front line of the coronavirus fight",451,0.37857142857142856,0.6357142857142857
3359,"to everyone struggling with this new #lockdown world we live in, trying to avoid #coronavirus, it's very important that you know something: this was preventable. #trump ignored the expert advice in january and wasted the time needed to get testing ready. #voteblue2020 rt this!",33,0.16854545454545455,0.4909090909090909
3360,state and local officials have been divided on how to handle gun businesses during coronavirus-related shutdowns. most have allowed them to stay open with limitations on hours and number of customers. some have closed them. some have flip-flopped.,11,0.1,0.275
3361,it's good giuliani got suspended for pushing fake coronavirus news but it does sort of highlight the fact that trump has not been,82,0.09999999999999998,0.8
3362,101-year-old italian man has ‘truly extraordinary’ recovery from the coronavirus http://dlvr.it/rslynh,19,0.16666666666666666,0.5
3363,how much compensation should china be fined for the inept handling of the coronavirus ?,18,0.2,0.2
3364,"see what #trump's doing? he thinks if he's a 'war time president' he'll be re-elected. but most americans will never forget his colossal incompetence, his psycho behavior, his partisan bs &amp; how he let yet another enemy attack us w/o him defending us...#trump #covid19 #coronavirus",91,0.4,0.65
3365,"police and the defence force have greeted international passengers this morning, escorting them to hotels for 14 days of mandatory quarantine. #coronavirus",37,0.0,0.0
3366,"""there’s never a dull moment when it comes to boy band a.c.e"" coronavirus in korea: how k-pop stars from twice to nct are coping with social distancing",17,0.08958333333333333,0.2833333333333333
3367,i want the corona virus to kill me so i can forget i ever saw this,8,0.0,0.0
3368,usa coronavirus: covid-19 may hit rural america later — and harder - vox,56,-0.03333333333333333,0.0
3369,"cnn: 2,000 people in the united states have died from coronavirus.",104,0.0,0.0
3370,i can't even rewatch game of thrones cos i know the dissapointment that's waiting for me at the end. coronavirus plis.,6,-0.4,0.4
3371,this is literally the equivalent of me pulling loose change out of my couch and donating it to coronavirus research.,3,-0.07692307692307693,0.2692307692307692
3372,"#china's total #coronavirus cases on mainland hit 81,439, 3,300 deaths on end-march 28 #breaking",21,0.0,0.75
3373,jokes on you coronavirus i didnt have a life in the first place,4,0.25,0.3333333333333333
3374,"china's cdc chief says #wuhan market may not have been #coronavirus origin: ""from the very beginning, everybody thought the origin was the market. now, i think the market could be the initial place, or it could be a place where the virus was amplified.""",16,0.1,0.15
3375,christopher maloney had coronavirus before anyone in the world,3,0.0,0.0
3376,"coronavirus update, europe: - spain: 7,516 new cases - italy: 5,974 new cases - germany: 5,646 new cases - france: 4,611 new cases - uk: 2,546 new cases - belgium: 1,850 new cases - turkey: 1,704 new cases - netherlands: 1,159 new cases - switzerland: 1,148 new cases",4,0.13636363636363635,0.45454545454545453
3377,geriatricians' advice on what older adults need to do in coronavirus pandemic,11,0.16666666666666666,0.3333333333333333
3378,"one day after a state department of health spokesperson told @hawaiinewsnow that they were not keeping track of the number of people in hawaii who had recovered from the coronavirus, their website now shows exactly that. https://twitter.com/ianscheuring/status/1243715400346583040",4,0.25,0.25
3379,govt not including people who die outside hospital in cv deaths total 21 year olds death from #coronavirus #covid19 not recorded #skynews #channel4news #bbcnews #bethrigby #ridge #marr https://skwawkbox.org/2020/03/28/govt-not-including-people-who-die-outside-hospital-in-cv-deaths-total/ via @skwawkbox,22,0.0,0.4
3380,corona virus is bad and all but i think if you’ve survived what mono has to offer you should be fine,2,-0.14166666666666658,0.5833333333333333
3381,think when coronavirus is over australia's economy will snap back into place? good luck with that | greg jericho,13,0.35,0.30000000000000004
3382,"knowing who is immune from #coronavirus, and who is not, could be a powerful weapon in identifying healthcare workers best able to provide support, not to mention regular workers able to re-enter the economy. #covid_19",13,0.45999999999999996,0.5253846153846153
3383,we are making our contribution to the #coronavirus by enjoying family time together play cards. what are y’awl doing?,5,0.5,0.6
3384,"due to the coronavirus pandemic and with the major lockdowns in place, the organization is now focusing on families who need money to just feed themselves. we’re just $1111 away from our goal of $12,000. dm me if you’re interested in contributing!",13,0.08333333333333333,0.4583333333333333
3385,#delhihungerreliefcentre: delhi shelters where needy people can get meals. lunch : 12-03 pm everyday dinner: 06-09 pm everyday spread the news #21dayslockdown #coronavirus #sidhearts #indiafightscorona #covid19 #sarscov2,17,-0.2,0.6
3386,pray for #italy we all #greek #christians pray that the tragedy with the #coronavirus in italy will end soon. #lastampa #rai1 #matteosalvini #greek #κορονoιος #κοσμος #καραντινα #μενουμεσπίτι,11,0.0,0.0
3387,"great news this morning that a funding boost will be announced today for mental health, domestic violence, medicare and emergency food services #covid19 #coronavirus australia @dpoaustralia",7,0.23333333333333336,0.35000000000000003
3388,living in a pandemic: how the world is coping with the coronavirus,7,0.0,0.0
3389,"when being socially distant is getting old, you sit on the square in downtown aurora, waving & honky as people drive by. great to see people & some #aurorahuskies #coronavirus #6ftaway",0,0.26666666666666666,0.43333333333333335
3390,"is there a bounty? ""rhode island governor tells new yorkers they'll hunt them down to stop wuhan coronavirus spread""",24,-0.009595959595959616,0.3717171717171717
3391,"how many texas ladies know that governor abbott has stopped all abortions in the state of texas due to the corona virus. he says planned parenthood is not essential services. an unwanted pregnancy awaits for no one. plus, abortions is not the only service they provide.1/2",15,0.09375,0.54375
3392,"despite constant barrage of negative criticism of @realdonaldtrump’s handling of the pandemic by msm, sees criticism is unjustified, that our president is a man of action, doing all he can to combat #coronavirus ...meanwhile all @speakerpelosi did was pork up the #reliefbill",133,-0.06666666666666667,0.2777777777777778
3393,more than 700 new jersey police officers test positive for the coronavirus https://www.nbcnews.com/health/health-news/live-blog/live-coronavirus-updates-u-s-first-top-100-000-cases-n1171011/ncrd1171296 via @nbcnews,519,0.2878787878787879,0.5
3394,"just in: confirmed coronavirus deaths in us hit 2,000, doubling in two days http://hill.cm/dtsullb",54,0.4,1.0
3395,"kristen bell is hosting a nickelodeon special addressing kids’ coronavirus concerns. “i feel like right now, kids’ questions and worries might be getting overlooked,” the 39-year-old mom of two said about her involvement in the hour-long special.",14,0.3333333333333333,0.5595238095238095
3396,"just saw a headline confirming that u.s. coronavirus-related deaths doubled in two days, hitting 2000. i just threw down my phone. sobbed. idk.",51,-0.15555555555555559,0.2888888888888889
3397,we are winning!!! giant developments! trump is taking over the deep state and huge coronavirus news! https://banned.video/watch?id=5e7fdf65d02aaa00a2cdb30e,10,0.369140625,0.7625
3398,"thread.... go through and let's talk #coronavirus..... put in mind, its a sitting mp. fellow kenyans, here we go..... https://twitter.com/kiariejohn/status/1244011670529286144?s=20 #coronaupdate #covid_19 #coronaviruske",46,0.0,0.0
3399,"perspective. on march 5, there were 11 coronavirus deaths in the u.s. on march 12, there were 38. on march 19, there were 149. on march 26, there were 938. right now - three days later - there are more than 2,000 deaths in the u.s.",1975,0.2619047619047619,0.3452380952380952
3400,"so let me get this straight... people who have been saying they don't trust the media for the last 4 years, all of a sudden coronavirus happens and they hang on every word as truth? okey dokey...",143,0.06666666666666667,0.32222222222222224
3401,went for a run this evening... god reminded me that no matter what happens during day he is always there at the end. #pray #coronavirus,8,0.0,0.0
3402,our country has never needed american ingenuity more than it does at this moment & we’re here ready to serve! be part of the solution! join our mission in combating the coronavirus pandemic &amp; share! #americastrong #stayrelentless #endcovid19 #unifyandconquer @msnbc,95,0.296875,0.3333333333333333
3403,"more than 2,000 americans have already died from the coronavirus, but the president of the united states is tweeting about his television ratings, poll numbers, and the british royal family. i have never seen a president this wilfully incompetent.",3481,0.05000000000000001,0.2888888888888889
3404,every u.s. media outlet claiming the u.s. has the most coronavirus cases in the world is repeating chinese propaganda.,359,0.13333333333333333,0.19999999999999998
3405,important interview with noam chomsky about the coronavirus crisis &amp; the disastrous situation in the us,18,-0.14999999999999997,0.9
3406,a rockland county dad isn’t taking any chances of catching coronavirus and has locked his son out of the house after the 21-year-old partied on spring break during the outbreak.,13,0.6,0.9
3407,"president trump has said the u.s. coronavirus death toll could have reached 2.2 million without social distancing restrictions, and it would signal ""we all together have done a very good job"" if the number is limited to 100,000 to 200,000",45,0.29063492063492063,0.3298412698412699
3408,"coronavirus closures will force rats into our homes: as scraps from restaurant dumpsters start to dwindle, the rats are going to do whatever is necessary to find food and survive. they may very well start wriggling under doors and into kitchens.",21,0.1,0.65
3409,will china ever be held accountable for #coronavirus ???,398,0.0,0.0
3410,coronavirus: mercedes f1 to make breathing aid,709,0.0,0.0
3411,"the @nygovcuomo is actively pushing to repeal bail reform that has already saved thousands from pretrial jailing &amp; the coronavirus outbreak, in order to jail thousands more. he’s also leaving thousands he could release today imprisoned &amp; at high risk of infection. not impressed.",52,-0.014666666666666672,0.528
3412,new: there are now 818 nypd officers with coronavirus. nypd expects this number to be 900 by monday morning. 12.8% of the police force is out sick.,59,-0.288961038961039,0.6558441558441558
3413,"today 13% of the nypd is out sick, 4,651 officers. police commissioner dermot shea said he expects 900 to have tested positive for coronavirus by tomorrow morning.",2711,-0.2435064935064935,0.7012987012987013
3414,the rudeness of whitehouse reporters is astonishing. the line of questioning is all political rather than probing the vast issues related to the coronavirus. the president is very transparent. he says what comes to mind. the opposite would be a president that fbi'd the press. #44,31,0.11666666666666665,0.4666666666666666
3415,god please wash the coronavirus away,123,0.0,0.0
3416,"spongebob fact: the coronavirus is not even a thing in bikini bottom, but squidward’s girl told him she has to social distance. he’s down bad",448,-0.274074074074074,0.34074074074074073
3417,appreciate @centurylink stepping up to serve #usnsmercy—it “donated and installed high-speed broadband to the hospital ship.” the 1-gigabit connection between the ship and a @usdisa facility on shore will help address #coronavirus-related healthcare needs. https://www.multichannel.com/news/centurylink-supplies-ship-to-shore-connection-to-mercy,27,0.0,0.0
3418,number 2 in google in trending coronavirus searches in australia in the past 24 hours.,15,-0.25,0.25
3419,"whoa. &gt;3.38 billion people worldwide are under #lockdown to limit the spread of #coronavirus, per @afp. this represents **43% of the total world population**. #covid19 #coronaviruspandemic",267,0.0,0.75
3420,"'mosques' coronavirus breeding grounds, a lot of muslims run food outlets, avoid all muslim run food outlets and shops dont put yourself at risk.",13,0.0,0.0
3421,absolutely dreading april fool's day: coronavirus edition,3,0.2,0.9
3422,"remember when barack obama made this big, impassioned speech about 7 years ago about empathy and how important it was to the country moving forward? reading people talk about coronavirus shows that we failed that, pretty miserably.",3,-0.16999999999999998,0.68
3423,the obama administration never developed tests for #covid_19 bc there was no #coronavirus during obama’s presidency. good grief. #trumppressconference,12,-0.050000000000000044,0.3666666666666667
3424,[sport] | pique joins nadal and gasol's fight against coronavirus. the defender has donated to the red cross responds campaign.,10,0.0,0.0
3425,shout out to ⁦@raquelnamuche⁩ working for the people! solidarity in action: coronavirus mutual aid networks spring up across nyc | the indypendent,8,0.1,0.1
3426,manny pacquiao tests himself for coronavirus after being told to self-isolate https://www.mirror.co.uk/sport/boxing/manny-pacquiao-tests-himself-coronavirus-21777234,13,0.0,0.0
3427,anyone else out there just tryin’ to keep the romance alive? #badumtsss #shegotjokes #coronavirus #sundayfunday #shannonigans #quaranteam #helovesme,7,0.1,0.4
3428,"#coronavirus update: social worker chun rosencranz is to some an ""angel."" why? because he is buying and handing out food to the homeless during the pandemic. @davecarlintv reports",13,0.03333333333333333,0.06666666666666667
3429,"opinion: #saudi arabia’s swift #coronavirus response to protect and support its citizens has generated unprecedented national unity and solidarity, while iranian citizens will be forced to reevaluate their regime's priorities, writes @sultanalthari.",5,0.14999999999999997,0.55
3430,volunteers continue to hand out food and supplies checking in on at risk folks during the #coronavirus lockdown in #aleppo city #syria #syrianarmy please feel free to follow for daily syrian arab army updates,8,0.2,0.4
3431,"it’s time to keep jurass-at home! #jurassichome #staysafestayjurassic . due to coronavirus we are currently all living in a challenging, and at times frightening, world many of us are now having to stay home all of the time to help everyone stay safe..... @colintrevorrow",6,0.14583333333333334,0.6291666666666667
3432,"currently, our cdc is recommending against the use of masks by the general public to fight #coronavirus. this great thread discusses why that may be a mistake. masks could be a great tool that we are neglecting to use in this fight. #coronavirususa #kag #twgrp",62,0.33,0.49333333333333335
